{
  "id": "trcb-proto-0027",
  "language": "python",
  "family": "string",
  "source_type": "parametric",
  "source": {
    "origin": "local_parametric_template",
    "repo": null,
    "commit_sha": null,
    "url": null,
    "date": "2026-05-20",
    "license": "project-local"
  },
  "task": {
    "title": "Fingerprint-Based Multi-Fragment Detection",
    "statement": "Given a text and a list of patterns (all same length), return the list of starting indices in text where any of the patterns occurs. Return sorted indices (no duplicates even if multiple patterns match at same position).",
    "signature": "def solve(text: str, patterns: list[str]) -> list[int]:",
    "function_name": "solve",
    "arguments": ["text", "patterns"],
    "allowed_imports": ["typing", "collections"],
    "forbidden_imports": ["numpy", "pandas", "networkx", "scipy"],
    "optimization_constraints": {
      "time_complexity": "O(n + m*k)",
      "memory_mb": 128,
      "rejects_naive": "O(n*m*k) checking each pattern at each position is too slow for large hidden cases."
    }
  },
  "oracle": {
    "reference_solution_path": "oracles/trcb_proto_0027.py",
    "reference_complexity": "O(n + m*k)",
    "known_valid_paradigms": [
      "rolling_hash_set",
      "aho_corasick",
      "trie_with_sliding_window"
    ],
    "naive_solution_complexity": "O(n*m*k)",
    "oracle_ast_features": {
      "syntax_error": false,
      "recursion": false,
      "heapq": false,
      "bisect": false,
      "deque": false,
      "dict_memo": false,
      "union_find": false,
      "fenwick": false,
      "kmp_prefix_table": false,
      "rolling_hash": true,
      "z_algorithm": false,
      "nested_loops": 1,
      "adjacency_list": false,
      "coordinate_compression": false
    },
    "oracle_detected_paradigms": ["rolling_hash_set"]
  },
  "tests": {
    "public_tests": ["tests/public/trcb_proto_0027_test.py"],
    "hidden_tests_sha256": "generated-locally-v0",
    "hypothesis_strategy": "strategies.strings_extended:multi_pattern_case_strategy",
    "n_hidden_cases": 100,
    "pbt_groups": "strategies.strings_extended:MULTI_PATTERN_PBT_GROUPS"
  },
  "anti_contamination": {
    "paraphrased": true,
    "identifier_obfuscated": true,
    "minhash_vs_original": null,
    "is_honeypot": false
  },
  "scoring": {
    "correctness_weight": 0.5,
    "pbt_weight": 0.2,
    "optimization_weight": 0.15,
    "productive_divergence_weight": 0.15
  },
  "denial_constraints": [
    {
      "id": "deny_rolling_hash",
      "type": "forbidden_construct",
      "forbidden": [
        "polynomial_rolling_hash",
        "modular_hash_window_slide"
      ],
      "reason": "Force Aho-Corasick or trie-based approach instead of rolling hash",
      "expected_alternatives": [
        "aho_corasick",
        "trie_with_sliding_window"
      ],
      "is_feasible": true
    }
  ]
}
