{
  "id": "trcb-proto-0036",
  "language": "python",
  "family": "math",
  "source_type": "parametric",
  "source": {
    "origin": "local_parametric_template",
    "repo": null,
    "commit_sha": null,
    "url": null,
    "date": "2026-05-20",
    "license": "project-local"
  },
  "task": {
    "title": "Rapid Residual Power Computation",
    "statement": "Given integers base, exponent, and modulus (modulus > 0), compute (base^exponent) mod modulus. Exponent can be 0 (result is 1 mod modulus). Handle exponent = 0 correctly (return 1 % modulus).",
    "signature": "def solve(base: int, exponent: int, modulus: int) -> int:",
    "function_name": "solve",
    "arguments": ["base", "exponent", "modulus"],
    "allowed_imports": ["typing"],
    "forbidden_imports": ["numpy", "pandas", "networkx", "scipy"],
    "optimization_constraints": {
      "time_complexity": "O(log exponent)",
      "memory_mb": 128,
      "rejects_naive": "O(exponent) repeated multiplication is too slow for large hidden cases."
    }
  },
  "oracle": {
    "reference_solution_path": "oracles/trcb_proto_0036.py",
    "reference_complexity": "O(log exponent)",
    "known_valid_paradigms": [
      "iterative_squaring",
      "recursive_squaring",
      "python_builtin_pow"
    ],
    "naive_solution_complexity": "O(exponent)",
    "oracle_ast_features": {
      "syntax_error": false,
      "recursion": false,
      "heapq": false,
      "bisect": false,
      "deque": false,
      "dict_memo": false,
      "union_find": false,
      "fenwick": false,
      "kmp_prefix_table": false,
      "rolling_hash": false,
      "z_algorithm": false,
      "nested_loops": 0,
      "adjacency_list": false,
      "coordinate_compression": false
    },
    "oracle_detected_paradigms": ["iterative_squaring"]
  },
  "tests": {
    "public_tests": ["tests/public/trcb_proto_0036_test.py"],
    "hidden_tests_sha256": "generated-locally-v0",
    "hypothesis_strategy": "strategies.math_combinatorics:modexp_case_strategy",
    "n_hidden_cases": 100,
    "pbt_groups": "strategies.math_combinatorics:MODEXP_PBT_GROUPS"
  },
  "anti_contamination": {
    "paraphrased": true,
    "identifier_obfuscated": true,
    "minhash_vs_original": null,
    "is_honeypot": false
  },
  "scoring": {
    "correctness_weight": 0.5,
    "pbt_weight": 0.2,
    "optimization_weight": 0.15,
    "productive_divergence_weight": 0.15
  },
  "denial_constraints": [
    {
      "id": "deny_while_loop",
      "type": "forbidden_construct",
      "forbidden": [
        "while_loop_pattern"
      ],
      "reason": "Force recursive approach instead of iterative squaring loop",
      "expected_alternatives": [
        "recursive_squaring"
      ],
      "is_feasible": true
    }
  ]
}
