{
  "id": "trcb-proto-0016",
  "language": "python",
  "family": "dynamic_programming",
  "source_type": "parametric",
  "source": {
    "origin": "local_parametric_template",
    "repo": null,
    "commit_sha": null,
    "url": null,
    "date": "2026-05-20",
    "license": "project-local"
  },
  "task": {
    "title": "Minimum Symbol Transformations Between Sequences",
    "statement": "Given two strings word1 and word2, return the minimum number of single-character operations (insert, delete, replace) needed to convert word1 into word2.",
    "signature": "def solve(word1: str, word2: str) -> int:",
    "function_name": "solve",
    "arguments": [
      "word1",
      "word2"
    ],
    "allowed_imports": [
      "typing",
      "functools"
    ],
    "forbidden_imports": [
      "numpy",
      "pandas",
      "networkx",
      "scipy"
    ],
    "optimization_constraints": {
      "time_complexity": "O(n*m)",
      "memory_mb": 128,
      "rejects_naive": "O(3^max(n,m)) recursive without memoization is too slow for large hidden cases."
    }
  },
  "oracle": {
    "reference_solution_path": "oracles/trcb_proto_0016.py",
    "reference_complexity": "O(n*m)",
    "known_valid_paradigms": [
      "dp_table_full",
      "dp_space_optimized",
      "recursive_memoization"
    ],
    "naive_solution_complexity": "O(3^max(n,m))",
    "oracle_ast_features": {
      "syntax_error": false,
      "recursion": false,
      "heapq": false,
      "bisect": false,
      "deque": false,
      "dict_memo": false,
      "union_find": false,
      "fenwick": false,
      "kmp_prefix_table": false,
      "rolling_hash": false,
      "z_algorithm": false,
      "nested_loops": 2,
      "adjacency_list": false,
      "coordinate_compression": false
    },
    "oracle_detected_paradigms": [
      "dp_table_full"
    ]
  },
  "tests": {
    "public_tests": [
      "tests/public/trcb_proto_0016_test.py"
    ],
    "hidden_tests_sha256": "generated-locally-v0",
    "hypothesis_strategy": "strategies.dp:edit_distance_case_strategy",
    "n_hidden_cases": 100,
    "pbt_groups": "strategies.dp:EDIT_DISTANCE_PBT_GROUPS"
  },
  "anti_contamination": {
    "paraphrased": true,
    "identifier_obfuscated": true,
    "minhash_vs_original": null,
    "is_honeypot": false
  },
  "scoring": {
    "correctness_weight": 0.5,
    "pbt_weight": 0.2,
    "optimization_weight": 0.15,
    "productive_divergence_weight": 0.15
  },
  "denial_constraints": [
    {
      "id": "deny_nested_loops",
      "type": "forbidden_construct",
      "forbidden": [
        "nested_for_loops",
        "nested_while_loops"
      ],
      "reason": "Force recursive memoization with functools.lru_cache instead of iterative DP",
      "expected_alternatives": [
        "recursive_memoization"
      ],
      "is_feasible": true
    }
  ]
}
