{
  "id": "trcb-proto-0032",
  "language": "python",
  "family": "data_structure",
  "source_type": "parametric",
  "source": {
    "origin": "local_parametric_template",
    "repo": null,
    "commit_sha": null,
    "url": null,
    "date": "2026-05-20",
    "license": "project-local"
  },
  "task": {
    "title": "Interval Extremum Precomputation Queries",
    "statement": "Given an array of integers and a list of queries (l, r) (inclusive on both ends), for each query return the minimum value in the subarray from index l to index r. Preprocess to answer each query efficiently.",
    "signature": "def solve(arr: list[int], queries: list[tuple[int, int]]) -> list[int]:",
    "function_name": "solve",
    "arguments": ["arr", "queries"],
    "allowed_imports": ["math", "typing"],
    "forbidden_imports": ["numpy", "pandas", "networkx", "scipy"],
    "optimization_constraints": {
      "time_complexity": "O(n log n + q)",
      "memory_mb": 128,
      "rejects_naive": "O(n * q) scanning each query range is too slow for large hidden cases."
    }
  },
  "oracle": {
    "reference_solution_path": "oracles/trcb_proto_0032.py",
    "reference_complexity": "O(n log n + q)",
    "known_valid_paradigms": [
      "sparse_table",
      "segment_tree",
      "sqrt_decomposition"
    ],
    "naive_solution_complexity": "O(n * q)",
    "oracle_ast_features": {
      "syntax_error": false,
      "recursion": false,
      "heapq": false,
      "bisect": false,
      "deque": false,
      "dict_memo": false,
      "union_find": false,
      "fenwick": false,
      "kmp_prefix_table": false,
      "rolling_hash": false,
      "z_algorithm": false,
      "nested_loops": 2,
      "adjacency_list": false,
      "coordinate_compression": false
    },
    "oracle_detected_paradigms": ["sparse_table"]
  },
  "tests": {
    "public_tests": ["tests/public/trcb_proto_0032_test.py"],
    "hidden_tests_sha256": "generated-locally-v0",
    "hypothesis_strategy": "strategies.data_structures:range_min_query_case_strategy",
    "n_hidden_cases": 100,
    "pbt_groups": "strategies.data_structures:RANGE_MIN_QUERY_PBT_GROUPS"
  },
  "anti_contamination": {
    "paraphrased": true,
    "identifier_obfuscated": true,
    "minhash_vs_original": null,
    "is_honeypot": false
  },
  "scoring": {
    "correctness_weight": 0.5,
    "pbt_weight": 0.2,
    "optimization_weight": 0.15,
    "productive_divergence_weight": 0.15
  },
  "denial_constraints": [
    {
      "id": "deny_sparse_table_log_pattern",
      "type": "forbidden_construct",
      "forbidden": [
        "sparse_table_log_precomputation",
        "overlapping_interval_doubling_pattern"
      ],
      "reason": "Force segment tree or sqrt decomposition instead of sparse table",
      "expected_alternatives": [
        "segment_tree",
        "sqrt_decomposition"
      ],
      "is_feasible": true
    }
  ]
}
