{
  "id": "trcb-proto-0025",
  "language": "python",
  "family": "graph",
  "source_type": "parametric",
  "source": {
    "origin": "local_parametric_template",
    "repo": null,
    "commit_sha": null,
    "url": null,
    "date": "2026-05-20",
    "license": "project-local"
  },
  "task": {
    "title": "Critical Link Identification",
    "statement": "Given an undirected connected graph with n vertices (0 to n-1) and edges, find all bridges (edges whose removal disconnects the graph). Return a sorted list of edges as (min_vertex, max_vertex) tuples, sorted lexicographically.",
    "signature": "def solve(n: int, edges: list[tuple[int, int]]) -> list[tuple[int, int]]:",
    "function_name": "solve",
    "arguments": [
      "n",
      "edges"
    ],
    "allowed_imports": [
      "typing"
    ],
    "forbidden_imports": [
      "numpy",
      "pandas",
      "networkx",
      "scipy"
    ],
    "optimization_constraints": {
      "time_complexity": "O(V + E)",
      "memory_mb": 128,
      "rejects_naive": "O(E * (V+E)) removing each edge and checking connectivity is too slow for large hidden cases."
    }
  },
  "oracle": {
    "reference_solution_path": "oracles/trcb_proto_0025.py",
    "reference_complexity": "O(V + E)",
    "known_valid_paradigms": [
      "tarjan_bridge_dfs",
      "chain_decomposition",
      "block_cut_tree"
    ],
    "naive_solution_complexity": "O(E * (V+E))",
    "oracle_ast_features": {
      "syntax_error": false,
      "recursion": true,
      "heapq": false,
      "bisect": false,
      "deque": false,
      "dict_memo": false,
      "union_find": false,
      "fenwick": false,
      "kmp_prefix_table": false,
      "rolling_hash": false,
      "z_algorithm": false,
      "nested_loops": 1,
      "adjacency_list": true,
      "coordinate_compression": false
    },
    "oracle_detected_paradigms": [
      "tarjan_bridge_dfs"
    ]
  },
  "tests": {
    "public_tests": [
      "tests/public/trcb_proto_0025_test.py"
    ],
    "hidden_tests_sha256": "generated-locally-v0",
    "hypothesis_strategy": "strategies.graphs_extended:bridges_case_strategy",
    "n_hidden_cases": 100,
    "pbt_groups": "strategies.graphs_extended:BRIDGES_PBT_GROUPS"
  },
  "anti_contamination": {
    "paraphrased": true,
    "identifier_obfuscated": true,
    "minhash_vs_original": null,
    "is_honeypot": false
  },
  "scoring": {
    "correctness_weight": 0.5,
    "pbt_weight": 0.2,
    "optimization_weight": 0.15,
    "productive_divergence_weight": 0.15
  },
  "denial_constraints": [
    {
      "id": "deny_recursion",
      "type": "forbidden_construct",
      "forbidden": [
        "recursive_function_call",
        "def_inside_def_with_self_call"
      ],
      "reason": "Force iterative DFS with explicit stack",
      "expected_alternatives": [
        "iterative_dfs_explicit_stack"
      ],
      "is_feasible": true
    }
  ]
}
