{
  "id": "trcb-proto-0015",
  "language": "python",
  "family": "sorting",
  "source_type": "parametric",
  "source": {
    "origin": "local_parametric_template",
    "repo": null,
    "commit_sha": null,
    "url": null,
    "date": "2026-05-20",
    "license": "project-local"
  },
  "task": {
    "title": "Unified Ordering from Presorted Segments",
    "statement": "Given k sorted lists of integers, merge them into a single sorted list. Return the merged list.",
    "signature": "def solve(lists: list[list[int]]) -> list[int]:",
    "function_name": "solve",
    "arguments": [
      "lists"
    ],
    "allowed_imports": [
      "heapq",
      "typing"
    ],
    "forbidden_imports": [
      "numpy",
      "pandas",
      "networkx",
      "scipy"
    ],
    "optimization_constraints": {
      "time_complexity": "O(N log k)",
      "memory_mb": 128,
      "rejects_naive": "O(N*k) scan or O(N log N) flatten-and-sort are too slow for large hidden cases."
    }
  },
  "oracle": {
    "reference_solution_path": "oracles/trcb_proto_0015.py",
    "reference_complexity": "O(N log k)",
    "known_valid_paradigms": [
      "heap_merge",
      "divide_and_conquer_merge",
      "tournament_tree"
    ],
    "naive_solution_complexity": "O(N log N)",
    "oracle_ast_features": {
      "syntax_error": false,
      "recursion": false,
      "heapq": true,
      "bisect": false,
      "deque": false,
      "dict_memo": false,
      "union_find": false,
      "fenwick": false,
      "kmp_prefix_table": false,
      "rolling_hash": false,
      "z_algorithm": false,
      "nested_loops": 0,
      "adjacency_list": false,
      "coordinate_compression": false
    },
    "oracle_detected_paradigms": [
      "heap_merge"
    ]
  },
  "tests": {
    "public_tests": [
      "tests/public/trcb_proto_0015_test.py"
    ],
    "hidden_tests_sha256": "generated-locally-v0",
    "hypothesis_strategy": "strategies.sorting:merge_k_sorted_case_strategy",
    "n_hidden_cases": 100,
    "pbt_groups": "strategies.sorting:MERGE_K_SORTED_PBT_GROUPS"
  },
  "anti_contamination": {
    "paraphrased": true,
    "identifier_obfuscated": true,
    "minhash_vs_original": null,
    "is_honeypot": false
  },
  "scoring": {
    "correctness_weight": 0.5,
    "pbt_weight": 0.2,
    "optimization_weight": 0.15,
    "productive_divergence_weight": 0.15
  },
  "denial_constraints": [
    {
      "id": "deny_heapq",
      "type": "forbidden_api",
      "forbidden": [
        "heapq",
        "heappush",
        "heappop"
      ],
      "reason": "Force divide-and-conquer merge instead of heap merge",
      "expected_alternatives": [
        "divide_and_conquer_merge"
      ],
      "is_feasible": true
    }
  ]
}
