{
  "id": "trcb-proto-0034",
  "language": "python",
  "family": "data_structure",
  "source_type": "parametric",
  "source": {
    "origin": "local_parametric_template",
    "repo": null,
    "commit_sha": null,
    "url": null,
    "date": "2026-05-20",
    "license": "project-local"
  },
  "task": {
    "title": "Layered Collection with Instant Floor Query",
    "statement": "Process a sequence of stack operations: ('push', x) pushes x, ('pop') removes top, ('get_min') returns current minimum. The stack is initially empty. Pop on empty stack is a no-op. get_min on empty returns None. Return the list of results for 'get_min' operations only.",
    "signature": "def solve(operations: list[tuple]) -> list[int | None]:",
    "function_name": "solve",
    "arguments": ["operations"],
    "allowed_imports": ["typing"],
    "forbidden_imports": ["numpy", "pandas", "networkx", "scipy"],
    "optimization_constraints": {
      "time_complexity": "O(n)",
      "memory_mb": 128,
      "rejects_naive": "O(n^2) scanning all elements for minimum on each get_min is too slow for large hidden cases."
    }
  },
  "oracle": {
    "reference_solution_path": "oracles/trcb_proto_0034.py",
    "reference_complexity": "O(n)",
    "known_valid_paradigms": [
      "auxiliary_min_stack",
      "encoded_difference_stack",
      "sorted_multiset"
    ],
    "naive_solution_complexity": "O(n^2)",
    "oracle_ast_features": {
      "syntax_error": false,
      "recursion": false,
      "heapq": false,
      "bisect": false,
      "deque": false,
      "dict_memo": false,
      "union_find": false,
      "fenwick": false,
      "kmp_prefix_table": false,
      "rolling_hash": false,
      "z_algorithm": false,
      "nested_loops": 0,
      "adjacency_list": false,
      "coordinate_compression": false
    },
    "oracle_detected_paradigms": ["auxiliary_min_stack"]
  },
  "tests": {
    "public_tests": ["tests/public/trcb_proto_0034_test.py"],
    "hidden_tests_sha256": "generated-locally-v0",
    "hypothesis_strategy": "strategies.data_structures:min_stack_case_strategy",
    "n_hidden_cases": 100,
    "pbt_groups": "strategies.data_structures:MIN_STACK_PBT_GROUPS"
  },
  "anti_contamination": {
    "paraphrased": true,
    "identifier_obfuscated": true,
    "minhash_vs_original": null,
    "is_honeypot": false
  },
  "scoring": {
    "correctness_weight": 0.5,
    "pbt_weight": 0.2,
    "optimization_weight": 0.15,
    "productive_divergence_weight": 0.15
  },
  "denial_constraints": [
    {
      "id": "deny_dual_stack_pattern",
      "type": "forbidden_construct",
      "forbidden": [
        "parallel_min_stack_tracking",
        "dual_stack_auxiliary_minimum"
      ],
      "reason": "Force encoded difference approach instead of dual-stack",
      "expected_alternatives": [
        "encoded_difference_stack",
        "sorted_multiset"
      ],
      "is_feasible": true
    }
  ]
}
