{
  "id": "trcb-proto-0028",
  "language": "python",
  "family": "string",
  "source_type": "parametric",
  "source": {
    "origin": "local_parametric_template",
    "repo": null,
    "commit_sha": null,
    "url": null,
    "date": "2026-05-20",
    "license": "project-local"
  },
  "task": {
    "title": "Maximum Recurrence Fragment Length",
    "statement": "Given a string s, return the length of the longest substring that appears at least twice in s. Return 0 if no substring repeats.",
    "signature": "def solve(s: str) -> int:",
    "function_name": "solve",
    "arguments": ["s"],
    "allowed_imports": ["typing", "collections"],
    "forbidden_imports": ["numpy", "pandas", "networkx", "scipy"],
    "optimization_constraints": {
      "time_complexity": "O(n log n)",
      "memory_mb": 128,
      "rejects_naive": "O(n^3) checking all substring pairs is too slow for large hidden cases."
    }
  },
  "oracle": {
    "reference_solution_path": "oracles/trcb_proto_0028.py",
    "reference_complexity": "O(n log n)",
    "known_valid_paradigms": [
      "binary_search_rolling_hash",
      "suffix_array_lcp",
      "suffix_tree"
    ],
    "naive_solution_complexity": "O(n^3)",
    "oracle_ast_features": {
      "syntax_error": false,
      "recursion": false,
      "heapq": false,
      "bisect": false,
      "deque": false,
      "dict_memo": false,
      "union_find": false,
      "fenwick": false,
      "kmp_prefix_table": false,
      "rolling_hash": true,
      "z_algorithm": false,
      "nested_loops": 2,
      "adjacency_list": false,
      "coordinate_compression": false
    },
    "oracle_detected_paradigms": ["binary_search_rolling_hash"]
  },
  "tests": {
    "public_tests": ["tests/public/trcb_proto_0028_test.py"],
    "hidden_tests_sha256": "generated-locally-v0",
    "hypothesis_strategy": "strategies.strings_extended:repeated_substr_case_strategy",
    "n_hidden_cases": 100,
    "pbt_groups": "strategies.strings_extended:REPEATED_SUBSTR_PBT_GROUPS"
  },
  "anti_contamination": {
    "paraphrased": true,
    "identifier_obfuscated": true,
    "minhash_vs_original": null,
    "is_honeypot": false
  },
  "scoring": {
    "correctness_weight": 0.5,
    "pbt_weight": 0.2,
    "optimization_weight": 0.15,
    "productive_divergence_weight": 0.15
  },
  "denial_constraints": [
    {
      "id": "deny_rolling_hash",
      "type": "forbidden_construct",
      "forbidden": [
        "polynomial_rolling_hash",
        "modular_hash_window_slide"
      ],
      "reason": "Force suffix array approach instead of rolling hash",
      "expected_alternatives": [
        "suffix_array_lcp",
        "suffix_tree"
      ],
      "is_feasible": true
    }
  ]
}
