{
  "id": "trcb-proto-0012",
  "language": "python",
  "family": "sorting",
  "source_type": "parametric",
  "source": {
    "origin": "local_parametric_template",
    "repo": null,
    "commit_sha": null,
    "url": null,
    "date": "2026-05-20",
    "license": "project-local"
  },
  "task": {
    "title": "Rank Selection in Unordered Collection",
    "statement": "Given a list of integers and an integer k (1-indexed), return the k-th largest element. Guaranteed 1 \u2264 k \u2264 len(nums).",
    "signature": "def solve(nums: list[int], k: int) -> int:",
    "function_name": "solve",
    "arguments": [
      "nums",
      "k"
    ],
    "allowed_imports": [
      "random",
      "heapq",
      "typing"
    ],
    "forbidden_imports": [
      "numpy",
      "pandas",
      "networkx",
      "scipy"
    ],
    "optimization_constraints": {
      "time_complexity": "O(n) average",
      "memory_mb": 128,
      "rejects_naive": "O(n log n) full sort or O(n*k) repeated scan are too slow for large hidden cases."
    }
  },
  "oracle": {
    "reference_solution_path": "oracles/trcb_proto_0012.py",
    "reference_complexity": "O(n) average",
    "known_valid_paradigms": [
      "quickselect",
      "median_of_medians",
      "heap_partial_sort"
    ],
    "naive_solution_complexity": "O(n log n)",
    "oracle_ast_features": {
      "syntax_error": false,
      "recursion": true,
      "heapq": false,
      "bisect": false,
      "deque": false,
      "dict_memo": false,
      "union_find": false,
      "fenwick": false,
      "kmp_prefix_table": false,
      "rolling_hash": false,
      "z_algorithm": false,
      "nested_loops": 0,
      "adjacency_list": false,
      "coordinate_compression": false
    },
    "oracle_detected_paradigms": [
      "quickselect"
    ]
  },
  "tests": {
    "public_tests": [
      "tests/public/trcb_proto_0012_test.py"
    ],
    "hidden_tests_sha256": "generated-locally-v0",
    "hypothesis_strategy": "strategies.sorting:kth_largest_case_strategy",
    "n_hidden_cases": 100,
    "pbt_groups": "strategies.sorting:KTH_LARGEST_PBT_GROUPS"
  },
  "anti_contamination": {
    "paraphrased": true,
    "identifier_obfuscated": true,
    "minhash_vs_original": null,
    "is_honeypot": false
  },
  "scoring": {
    "correctness_weight": 0.5,
    "pbt_weight": 0.2,
    "optimization_weight": 0.15,
    "productive_divergence_weight": 0.15
  },
  "denial_constraints": [
    {
      "id": "deny_recursion",
      "type": "forbidden_structure",
      "forbidden": [
        "recursion",
        "recursive_call"
      ],
      "reason": "Force heap-based approach instead of quickselect",
      "expected_alternatives": [
        "heap_partial_sort"
      ],
      "is_feasible": true
    }
  ]
}
