{
  "id": "trcb-proto-0022",
  "language": "python",
  "family": "graph",
  "source_type": "parametric",
  "source": {
    "origin": "local_parametric_template",
    "repo": null,
    "commit_sha": null,
    "url": null,
    "date": "2026-05-20",
    "license": "project-local"
  },
  "task": {
    "title": "Mutual Reachability Clusters",
    "statement": "Given a directed graph with n vertices (0 to n-1) and edges, return the number of strongly connected components (maximal subsets where every vertex is reachable from every other vertex in the subset).",
    "signature": "def solve(n: int, edges: list[tuple[int, int]]) -> int:",
    "function_name": "solve",
    "arguments": [
      "n",
      "edges"
    ],
    "allowed_imports": [
      "collections",
      "typing"
    ],
    "forbidden_imports": [
      "numpy",
      "pandas",
      "networkx",
      "scipy"
    ],
    "optimization_constraints": {
      "time_complexity": "O(V + E)",
      "memory_mb": 128,
      "rejects_naive": "O(V^2 * (V+E)) BFS from each pair is too slow for large hidden cases."
    }
  },
  "oracle": {
    "reference_solution_path": "oracles/trcb_proto_0022.py",
    "reference_complexity": "O(V + E)",
    "known_valid_paradigms": [
      "kosaraju_two_pass",
      "tarjan_single_pass",
      "path_based_scc"
    ],
    "naive_solution_complexity": "O(V^2 * (V+E))",
    "oracle_ast_features": {
      "syntax_error": false,
      "recursion": false,
      "heapq": false,
      "bisect": false,
      "deque": true,
      "dict_memo": false,
      "union_find": false,
      "fenwick": false,
      "kmp_prefix_table": false,
      "rolling_hash": false,
      "z_algorithm": false,
      "nested_loops": 1,
      "adjacency_list": true,
      "coordinate_compression": false
    },
    "oracle_detected_paradigms": [
      "kosaraju_two_pass"
    ]
  },
  "tests": {
    "public_tests": [
      "tests/public/trcb_proto_0022_test.py"
    ],
    "hidden_tests_sha256": "generated-locally-v0",
    "hypothesis_strategy": "strategies.graphs_extended:scc_case_strategy",
    "n_hidden_cases": 100,
    "pbt_groups": "strategies.graphs_extended:SCC_PBT_GROUPS"
  },
  "anti_contamination": {
    "paraphrased": true,
    "identifier_obfuscated": true,
    "minhash_vs_original": null,
    "is_honeypot": false
  },
  "scoring": {
    "correctness_weight": 0.5,
    "pbt_weight": 0.2,
    "optimization_weight": 0.15,
    "productive_divergence_weight": 0.15
  },
  "denial_constraints": [
    {
      "id": "deny_reverse_graph",
      "type": "forbidden_construct",
      "forbidden": [
        "reverse_adjacency_list",
        "transposed_graph"
      ],
      "reason": "Force Tarjan's single-pass approach instead of Kosaraju's two-pass",
      "expected_alternatives": [
        "tarjan_single_pass"
      ],
      "is_feasible": true
    }
  ]
}
