{
  "id": "trcb-proto-0007",
  "language": "python",
  "family": "arrays",
  "source_type": "parametric",
  "source": {
    "origin": "local_parametric_template",
    "repo": null,
    "commit_sha": null,
    "url": null,
    "date": "2026-05-12",
    "license": "project-local"
  },
  "task": {
    "title": "Maximum of Each Fixed Window",
    "statement": "Given a list and a window size k, return the maximum value in each contiguous window of length k from left to right. Return an empty list when k <= 0 or k is larger than the list.",
    "signature": "def solve(nums: list[int], k: int) -> list[int]:",
    "function_name": "solve",
    "arguments": [
      "nums",
      "k"
    ],
    "allowed_imports": [
      "collections",
      "heapq",
      "typing"
    ],
    "forbidden_imports": [
      "numpy",
      "pandas"
    ],
    "optimization_constraints": {
      "time_complexity": "O(n)",
      "memory_mb": 64,
      "rejects_naive": "Computing max from scratch for every window is too slow."
    }
  },
  "oracle": {
    "reference_solution_path": "oracles/trcb_proto_0007.py",
    "reference_complexity": "O(n)",
    "known_valid_paradigms": [
      "monotonic_deque",
      "lazy_heap",
      "block_prefix_suffix"
    ],
    "naive_solution_complexity": "O(n*k)",
    "oracle_ast_features": {
      "syntax_error": false,
      "recursion": false,
      "heapq": false,
      "bisect": false,
      "deque": true,
      "dict_memo": false,
      "union_find": false,
      "fenwick": false,
      "kmp_prefix_table": false,
      "rolling_hash": false,
      "z_algorithm": false,
      "nested_loops": 2,
      "adjacency_list": false,
      "coordinate_compression": false
    },
    "oracle_detected_paradigms": [
      "monotonic_deque"
    ]
  },
  "tests": {
    "public_tests": [
      "tests/public/trcb_proto_0007_test.py"
    ],
    "hidden_tests_sha256": "generated-locally-v0",
    "hypothesis_strategy": "strategies.arrays:sliding_window_case_strategy",
    "n_hidden_cases": 100,
    "pbt_groups": "strategies.arrays:SLIDING_WINDOW_PBT_GROUPS"
  },
  "anti_contamination": {
    "paraphrased": true,
    "identifier_obfuscated": true,
    "minhash_vs_original": null,
    "is_honeypot": false
  },
  "scoring": {
    "correctness_weight": 0.5,
    "pbt_weight": 0.2,
    "optimization_weight": 0.15,
    "productive_divergence_weight": 0.15
  },
  "denial_constraints": [
    {
      "id": "deny_deque",
      "type": "forbidden_import",
      "forbidden": [
        "deque"
      ],
      "reason": "Force heap or block decomposition approach",
      "expected_alternatives": [
        "lazy_heap",
        "block_prefix_suffix"
      ],
      "is_feasible": true
    },
    {
      "id": "deny_heapq",
      "type": "forbidden_import",
      "forbidden": [
        "heapq"
      ],
      "reason": "Force monotonic deque or block approach",
      "expected_alternatives": [
        "monotonic_deque",
        "block_prefix_suffix"
      ],
      "is_feasible": true
    }
  ]
}
