{
  "id": "trcb-proto-0005",
  "language": "python",
  "family": "data_structure",
  "source_type": "parametric",
  "source": {
    "origin": "local_parametric_template",
    "repo": null,
    "commit_sha": null,
    "url": null,
    "date": "2026-05-12",
    "license": "project-local"
  },
  "task": {
    "title": "Batch Connectivity After Merges",
    "statement": "Given n isolated nodes, apply every pair in unions as an undirected merge. Then answer each query with whether the two nodes are in the same connected component.",
    "signature": "def solve(n: int, unions: list[tuple[int, int]], queries: list[tuple[int, int]]) -> list[bool]:",
    "function_name": "solve",
    "arguments": [
      "n",
      "unions",
      "queries"
    ],
    "allowed_imports": [
      "collections",
      "typing"
    ],
    "forbidden_imports": [
      "networkx",
      "numpy",
      "scipy"
    ],
    "optimization_constraints": {
      "time_complexity": "O((n + m + q) alpha(n)) or near-linear",
      "memory_mb": 128,
      "rejects_naive": "Graph traversal per query is too slow when q is large."
    }
  },
  "oracle": {
    "reference_solution_path": "oracles/trcb_proto_0005.py",
    "reference_complexity": "O((n + m + q) alpha(n))",
    "known_valid_paradigms": [
      "union_find",
      "component_labeling_after_build",
      "offline_graph_traversal"
    ],
    "naive_solution_complexity": "O(q * (n + m))",
    "oracle_ast_features": {
      "syntax_error": false,
      "recursion": false,
      "heapq": false,
      "bisect": false,
      "deque": false,
      "dict_memo": false,
      "union_find": true,
      "fenwick": false,
      "kmp_prefix_table": false,
      "rolling_hash": false,
      "z_algorithm": false,
      "nested_loops": 0,
      "adjacency_list": false,
      "coordinate_compression": false
    },
    "oracle_detected_paradigms": [
      "union_find"
    ]
  },
  "tests": {
    "public_tests": [
      "tests/public/trcb_proto_0005_test.py"
    ],
    "hidden_tests_sha256": "generated-locally-v0",
    "hypothesis_strategy": "strategies.graphs:union_find_case_strategy",
    "n_hidden_cases": 100,
    "pbt_groups": "strategies.graphs:UNION_FIND_PBT_GROUPS"
  },
  "anti_contamination": {
    "paraphrased": true,
    "identifier_obfuscated": true,
    "minhash_vs_original": null,
    "is_honeypot": false
  },
  "scoring": {
    "correctness_weight": 0.5,
    "pbt_weight": 0.2,
    "optimization_weight": 0.15,
    "productive_divergence_weight": 0.15
  },
  "denial_constraints": [
    {
      "id": "deny_union_find_pattern",
      "type": "forbidden_paradigm",
      "forbidden": [
        "union_find",
        "disjoint_set"
      ],
      "reason": "Force graph traversal connectivity approach",
      "expected_alternatives": [
        "component_labeling_after_build",
        "offline_graph_traversal"
      ],
      "is_feasible": true
    },
    {
      "id": "deny_deque",
      "type": "forbidden_import",
      "forbidden": [
        "deque"
      ],
      "reason": "Force non-BFS connectivity check",
      "expected_alternatives": [
        "union_find",
        "component_labeling_after_build"
      ],
      "is_feasible": true
    }
  ]
}
