{
  "id": "trcb-proto-0035",
  "language": "python",
  "family": "data_structure",
  "source_type": "parametric",
  "source": {
    "origin": "local_parametric_template",
    "repo": null,
    "commit_sha": null,
    "url": null,
    "date": "2026-05-20",
    "license": "project-local"
  },
  "task": {
    "title": "Contiguous Region Consolidation",
    "statement": "Given a list of intervals [start, end], merge all overlapping intervals and return the merged list sorted by start time. Two intervals overlap if one starts before the other ends.",
    "signature": "def solve(intervals: list[tuple[int, int]]) -> list[tuple[int, int]]:",
    "function_name": "solve",
    "arguments": ["intervals"],
    "allowed_imports": ["typing"],
    "forbidden_imports": ["numpy", "pandas", "networkx", "scipy"],
    "optimization_constraints": {
      "time_complexity": "O(n log n)",
      "memory_mb": 128,
      "rejects_naive": "O(n^2) repeated pairwise merging is too slow for large hidden cases."
    }
  },
  "oracle": {
    "reference_solution_path": "oracles/trcb_proto_0035.py",
    "reference_complexity": "O(n log n)",
    "known_valid_paradigms": [
      "sort_and_merge",
      "sweep_line_events",
      "coordinate_compression_merge"
    ],
    "naive_solution_complexity": "O(n^2)",
    "oracle_ast_features": {
      "syntax_error": false,
      "recursion": false,
      "heapq": false,
      "bisect": false,
      "deque": false,
      "dict_memo": false,
      "union_find": false,
      "fenwick": false,
      "kmp_prefix_table": false,
      "rolling_hash": false,
      "z_algorithm": false,
      "nested_loops": 0,
      "adjacency_list": false,
      "coordinate_compression": false
    },
    "oracle_detected_paradigms": ["sort_and_merge"]
  },
  "tests": {
    "public_tests": ["tests/public/trcb_proto_0035_test.py"],
    "hidden_tests_sha256": "generated-locally-v0",
    "hypothesis_strategy": "strategies.data_structures:merge_intervals_case_strategy",
    "n_hidden_cases": 100,
    "pbt_groups": "strategies.data_structures:MERGE_INTERVALS_PBT_GROUPS"
  },
  "anti_contamination": {
    "paraphrased": true,
    "identifier_obfuscated": true,
    "minhash_vs_original": null,
    "is_honeypot": false
  },
  "scoring": {
    "correctness_weight": 0.5,
    "pbt_weight": 0.2,
    "optimization_weight": 0.15,
    "productive_divergence_weight": 0.15
  },
  "denial_constraints": [
    {
      "id": "deny_sorted_intervals",
      "type": "forbidden_construct",
      "forbidden": [
        "sorted_builtin_on_intervals",
        "list_sort_by_start_pattern"
      ],
      "reason": "Force sweep line with events approach instead of sort-and-merge",
      "expected_alternatives": [
        "sweep_line_events",
        "coordinate_compression_merge"
      ],
      "is_feasible": true
    }
  ]
}
