{
  "id": "trcb-proto-0021",
  "language": "python",
  "family": "graph",
  "source_type": "parametric",
  "source": {
    "origin": "local_parametric_template",
    "repo": null,
    "commit_sha": null,
    "url": null,
    "date": "2026-05-20",
    "license": "project-local"
  },
  "task": {
    "title": "Dependency-Respecting Linear Arrangement",
    "statement": "Given a directed acyclic graph with n vertices (0 to n-1) and a list of edges, return a valid topological ordering. If the graph has a cycle, return an empty list. If multiple valid orderings exist, return any one.",
    "signature": "def solve(n: int, edges: list[tuple[int, int]]) -> list[int]:",
    "function_name": "solve",
    "arguments": [
      "n",
      "edges"
    ],
    "allowed_imports": [
      "collections",
      "typing"
    ],
    "forbidden_imports": [
      "numpy",
      "pandas",
      "networkx",
      "scipy"
    ],
    "optimization_constraints": {
      "time_complexity": "O(V + E)",
      "memory_mb": 128,
      "rejects_naive": "O(V! * E) trying all permutations is too slow for large hidden cases."
    }
  },
  "oracle": {
    "reference_solution_path": "oracles/trcb_proto_0021.py",
    "reference_complexity": "O(V + E)",
    "known_valid_paradigms": [
      "kahn_bfs",
      "dfs_post_order_reverse",
      "parallel_source_removal"
    ],
    "naive_solution_complexity": "O(V! * E)",
    "oracle_ast_features": {
      "syntax_error": false,
      "recursion": false,
      "heapq": false,
      "bisect": false,
      "deque": true,
      "dict_memo": false,
      "union_find": false,
      "fenwick": false,
      "kmp_prefix_table": false,
      "rolling_hash": false,
      "z_algorithm": false,
      "nested_loops": 1,
      "adjacency_list": true,
      "coordinate_compression": false
    },
    "oracle_detected_paradigms": [
      "kahn_bfs"
    ]
  },
  "tests": {
    "public_tests": [
      "tests/public/trcb_proto_0021_test.py"
    ],
    "hidden_tests_sha256": "generated-locally-v0",
    "hypothesis_strategy": "strategies.graphs_extended:toposort_case_strategy",
    "n_hidden_cases": 100,
    "pbt_groups": "strategies.graphs_extended:TOPOSORT_PBT_GROUPS"
  },
  "anti_contamination": {
    "paraphrased": true,
    "identifier_obfuscated": true,
    "minhash_vs_original": null,
    "is_honeypot": false
  },
  "scoring": {
    "correctness_weight": 0.5,
    "pbt_weight": 0.2,
    "optimization_weight": 0.15,
    "productive_divergence_weight": 0.15
  },
  "denial_constraints": [
    {
      "id": "deny_deque",
      "type": "forbidden_construct",
      "forbidden": [
        "deque",
        "collections.deque"
      ],
      "reason": "Force DFS-based approach instead of BFS indegree method",
      "expected_alternatives": [
        "dfs_post_order_reverse"
      ],
      "is_feasible": true
    }
  ]
}
