{
  "id": "trcb-proto-0002",
  "language": "python",
  "family": "graph",
  "source_type": "parametric",
  "source": {
    "origin": "local_parametric_template",
    "repo": null,
    "commit_sha": null,
    "url": null,
    "date": "2026-05-12",
    "license": "project-local"
  },
  "task": {
    "title": "Positive-Weight Route Cost",
    "statement": "Given a directed graph with vertices 0 through n - 1 and positive edge weights, return the shortest distance from source to target. Return -1 when target is unreachable. When source equals target, return 0.",
    "signature": "def solve(n: int, edges: list[tuple[int, int, int]], source: int, target: int) -> int:",
    "function_name": "solve",
    "arguments": [
      "n",
      "edges",
      "source",
      "target"
    ],
    "allowed_imports": [
      "heapq",
      "collections",
      "math",
      "typing"
    ],
    "forbidden_imports": [
      "networkx",
      "numpy",
      "scipy"
    ],
    "optimization_constraints": {
      "time_complexity": "O((n + m) log n)",
      "memory_mb": 128,
      "rejects_naive": "Enumerating paths or repeated full relaxations is too slow."
    }
  },
  "oracle": {
    "reference_solution_path": "oracles/trcb_proto_0002.py",
    "reference_complexity": "O((n + m) log n)",
    "known_valid_paradigms": [
      "dijkstra_heap",
      "a_star_with_zero_heuristic",
      "bucketed_dijkstra_for_small_weights"
    ],
    "naive_solution_complexity": "exponential path enumeration or O(n*m) relaxation",
    "oracle_ast_features": {
      "syntax_error": false,
      "recursion": false,
      "heapq": true,
      "bisect": false,
      "deque": false,
      "dict_memo": false,
      "union_find": false,
      "fenwick": false,
      "kmp_prefix_table": false,
      "rolling_hash": false,
      "z_algorithm": false,
      "nested_loops": 1,
      "adjacency_list": true,
      "coordinate_compression": false
    },
    "oracle_detected_paradigms": [
      "dijkstra_heap",
      "a_star_with_zero_heuristic"
    ]
  },
  "tests": {
    "public_tests": [
      "tests/public/trcb_proto_0002_test.py"
    ],
    "hidden_tests_sha256": "generated-locally-v0",
    "hypothesis_strategy": "strategies.graphs:shortest_path_case_strategy",
    "n_hidden_cases": 100,
    "pbt_groups": "strategies.graphs:SHORTEST_PATH_PBT_GROUPS"
  },
  "anti_contamination": {
    "paraphrased": true,
    "identifier_obfuscated": true,
    "minhash_vs_original": null,
    "is_honeypot": false
  },
  "scoring": {
    "correctness_weight": 0.5,
    "pbt_weight": 0.2,
    "optimization_weight": 0.15,
    "productive_divergence_weight": 0.15
  },
  "denial_constraints": [
    {
      "id": "deny_heapq",
      "type": "forbidden_import",
      "forbidden": [
        "heapq"
      ],
      "reason": "Force non-Dijkstra shortest path",
      "expected_alternatives": [
        "bucketed_dijkstra_for_small_weights",
        "bellman_ford_with_early_stop"
      ],
      "is_feasible": true
    },
    {
      "id": "deny_adjacency_list",
      "type": "forbidden_structure",
      "forbidden": [
        "recursion"
      ],
      "reason": "Force iterative graph traversal",
      "expected_alternatives": [
        "bucketed_dijkstra_for_small_weights"
      ],
      "is_feasible": true
    }
  ]
}
