{
  "id": "trcb-proto-0040",
  "language": "python",
  "family": "math",
  "source_type": "parametric",
  "source": {
    "origin": "local_parametric_template",
    "repo": null,
    "commit_sha": null,
    "url": null,
    "date": "2026-05-20",
    "license": "project-local"
  },
  "task": {
    "title": "Recurrence Acceleration via Repeated Squaring",
    "statement": "Given n, compute the n-th Fibonacci number modulo 10^9 + 7. F(0) = 0, F(1) = 1, F(n) = F(n-1) + F(n-2). n can be very large (up to 10^18).",
    "signature": "def solve(n: int) -> int:",
    "function_name": "solve",
    "arguments": ["n"],
    "allowed_imports": ["typing"],
    "forbidden_imports": ["numpy", "pandas", "networkx", "scipy"],
    "optimization_constraints": {
      "time_complexity": "O(log n)",
      "memory_mb": 128,
      "rejects_naive": "O(n) iterative is too slow for n up to 10^18."
    }
  },
  "oracle": {
    "reference_solution_path": "oracles/trcb_proto_0040.py",
    "reference_complexity": "O(log n)",
    "known_valid_paradigms": [
      "matrix_exponentiation",
      "fast_doubling",
      "eigenvalue_closed_form"
    ],
    "naive_solution_complexity": "O(n)",
    "oracle_ast_features": {
      "syntax_error": false,
      "recursion": false,
      "heapq": false,
      "bisect": false,
      "deque": false,
      "dict_memo": false,
      "union_find": false,
      "fenwick": false,
      "kmp_prefix_table": false,
      "rolling_hash": false,
      "z_algorithm": false,
      "nested_loops": 2,
      "adjacency_list": false,
      "coordinate_compression": false
    },
    "oracle_detected_paradigms": ["matrix_exponentiation"]
  },
  "tests": {
    "public_tests": ["tests/public/trcb_proto_0040_test.py"],
    "hidden_tests_sha256": "generated-locally-v0",
    "hypothesis_strategy": "strategies.math_combinatorics:matrix_fib_case_strategy",
    "n_hidden_cases": 100,
    "pbt_groups": "strategies.math_combinatorics:MATRIX_FIB_PBT_GROUPS"
  },
  "anti_contamination": {
    "paraphrased": true,
    "identifier_obfuscated": true,
    "minhash_vs_original": null,
    "is_honeypot": false
  },
  "scoring": {
    "correctness_weight": 0.5,
    "pbt_weight": 0.2,
    "optimization_weight": 0.15,
    "productive_divergence_weight": 0.15
  },
  "denial_constraints": [
    {
      "id": "deny_matrix_multiplication",
      "type": "forbidden_construct",
      "forbidden": [
        "matrix_multiplication_nested_loop_pattern",
        "2x2_matrix_product"
      ],
      "reason": "Force fast doubling formulas instead of explicit matrix exponentiation",
      "expected_alternatives": [
        "fast_doubling"
      ],
      "is_feasible": true
    }
  ]
}
