{
  "id": "trcb-proto-0031",
  "language": "python",
  "family": "data_structure",
  "source_type": "parametric",
  "source": {
    "origin": "local_parametric_template",
    "repo": null,
    "commit_sha": null,
    "url": null,
    "date": "2026-05-20",
    "license": "project-local"
  },
  "task": {
    "title": "Bounded Recency-Ordered Store Operations",
    "statement": "Implement a bounded cache with a fixed capacity. Process a sequence of operations: ('get', key) returns the value or -1 if not found, ('put', key, value) inserts or updates. When capacity is exceeded, evict the least recently used item. Return the list of results for 'get' operations only.",
    "signature": "def solve(capacity: int, operations: list[tuple]) -> list[int]:",
    "function_name": "solve",
    "arguments": ["capacity", "operations"],
    "allowed_imports": ["collections", "typing"],
    "forbidden_imports": ["numpy", "pandas", "networkx", "scipy"],
    "optimization_constraints": {
      "time_complexity": "O(n)",
      "memory_mb": 128,
      "rejects_naive": "O(n^2) with linear search for LRU eviction is too slow for large hidden cases."
    }
  },
  "oracle": {
    "reference_solution_path": "oracles/trcb_proto_0031.py",
    "reference_complexity": "O(n)",
    "known_valid_paradigms": [
      "ordered_dict",
      "doubly_linked_list_hashmap",
      "dict_with_timestamp"
    ],
    "naive_solution_complexity": "O(n^2)",
    "oracle_ast_features": {
      "syntax_error": false,
      "recursion": false,
      "heapq": false,
      "bisect": false,
      "deque": false,
      "dict_memo": false,
      "union_find": false,
      "fenwick": false,
      "kmp_prefix_table": false,
      "rolling_hash": false,
      "z_algorithm": false,
      "nested_loops": 0,
      "adjacency_list": false,
      "coordinate_compression": false
    },
    "oracle_detected_paradigms": ["ordered_dict"]
  },
  "tests": {
    "public_tests": ["tests/public/trcb_proto_0031_test.py"],
    "hidden_tests_sha256": "generated-locally-v0",
    "hypothesis_strategy": "strategies.data_structures:lru_cache_case_strategy",
    "n_hidden_cases": 100,
    "pbt_groups": "strategies.data_structures:LRU_CACHE_PBT_GROUPS"
  },
  "anti_contamination": {
    "paraphrased": true,
    "identifier_obfuscated": true,
    "minhash_vs_original": null,
    "is_honeypot": false
  },
  "scoring": {
    "correctness_weight": 0.5,
    "pbt_weight": 0.2,
    "optimization_weight": 0.15,
    "productive_divergence_weight": 0.15
  },
  "denial_constraints": [
    {
      "id": "deny_ordered_dict",
      "type": "forbidden_construct",
      "forbidden": [
        "collections.OrderedDict",
        "OrderedDict_import_usage"
      ],
      "reason": "Force manual doubly-linked-list + hashmap implementation instead of OrderedDict",
      "expected_alternatives": [
        "doubly_linked_list_hashmap",
        "dict_with_timestamp"
      ],
      "is_feasible": true
    }
  ]
}
