{
  "id": "trcb-proto-0001",
  "language": "python",
  "family": "dynamic_programming",
  "source_type": "parametric",
  "source": {
    "origin": "local_parametric_template",
    "repo": null,
    "commit_sha": null,
    "url": null,
    "date": "2026-05-12",
    "license": "project-local"
  },
  "task": {
    "title": "Length of a Strictly Increasing Trace",
    "statement": "Given a list of integers, return the length of the longest strictly increasing subsequence. The subsequence does not need to be contiguous. An empty list has answer 0.",
    "signature": "def solve(nums: list[int]) -> int:",
    "function_name": "solve",
    "arguments": [
      "nums"
    ],
    "allowed_imports": [
      "bisect",
      "typing"
    ],
    "forbidden_imports": [
      "numpy",
      "pandas",
      "networkx",
      "scipy"
    ],
    "optimization_constraints": {
      "time_complexity": "O(n log n)",
      "memory_mb": 128,
      "rejects_naive": "O(n^2) dynamic programming is too slow for large hidden cases."
    }
  },
  "oracle": {
    "reference_solution_path": "oracles/trcb_proto_0001.py",
    "reference_complexity": "O(n log n)",
    "known_valid_paradigms": [
      "patience_sorting",
      "fenwick_tree_coordinate_compression",
      "segment_tree_dp"
    ],
    "naive_solution_complexity": "O(n^2)",
    "oracle_ast_features": {
      "syntax_error": false,
      "recursion": false,
      "heapq": false,
      "bisect": true,
      "deque": false,
      "dict_memo": false,
      "union_find": false,
      "fenwick": false,
      "kmp_prefix_table": false,
      "rolling_hash": false,
      "z_algorithm": false,
      "nested_loops": 0,
      "adjacency_list": false,
      "coordinate_compression": false
    },
    "oracle_detected_paradigms": [
      "patience_sorting"
    ]
  },
  "tests": {
    "public_tests": [
      "tests/public/trcb_proto_0001_test.py"
    ],
    "hidden_tests_sha256": "generated-locally-v0",
    "hypothesis_strategy": "strategies.arrays:lis_case_strategy",
    "n_hidden_cases": 100,
    "pbt_groups": "strategies.arrays:LIS_PBT_GROUPS"
  },
  "anti_contamination": {
    "paraphrased": true,
    "identifier_obfuscated": true,
    "minhash_vs_original": null,
    "is_honeypot": false
  },
  "scoring": {
    "correctness_weight": 0.5,
    "pbt_weight": 0.2,
    "optimization_weight": 0.15,
    "productive_divergence_weight": 0.15
  },
  "denial_constraints": [
    {
      "id": "deny_bisect",
      "type": "forbidden_api",
      "forbidden": [
        "bisect",
        "bisect_left",
        "bisect_right"
      ],
      "reason": "Force non-patience LIS solution",
      "expected_alternatives": [
        "fenwick_tree",
        "segment_tree"
      ],
      "is_feasible": true
    },
    {
      "id": "deny_fenwick",
      "type": "forbidden_structure",
      "forbidden": [
        "fenwick",
        "BIT"
      ],
      "reason": "Force segment-tree or alternative approach",
      "expected_alternatives": [
        "segment_tree_dp"
      ],
      "is_feasible": true
    }
  ]
}
