{
  "id": "trcb-proto-0024",
  "language": "python",
  "family": "graph",
  "source_type": "parametric",
  "source": {
    "origin": "local_parametric_template",
    "repo": null,
    "commit_sha": null,
    "url": null,
    "date": "2026-05-20",
    "license": "project-local"
  },
  "task": {
    "title": "Two-Group Compatibility Verification",
    "statement": "Given an undirected graph with n vertices (0 to n-1) and edges, determine if the graph is bipartite (can be 2-colored such that no edge connects same-color vertices). Return True if bipartite, False otherwise.",
    "signature": "def solve(n: int, edges: list[tuple[int, int]]) -> bool:",
    "function_name": "solve",
    "arguments": [
      "n",
      "edges"
    ],
    "allowed_imports": [
      "collections",
      "typing"
    ],
    "forbidden_imports": [
      "numpy",
      "pandas",
      "networkx",
      "scipy"
    ],
    "optimization_constraints": {
      "time_complexity": "O(V + E)",
      "memory_mb": 128,
      "rejects_naive": "O(2^V) trying all 2-colorings is too slow for large hidden cases."
    }
  },
  "oracle": {
    "reference_solution_path": "oracles/trcb_proto_0024.py",
    "reference_complexity": "O(V + E)",
    "known_valid_paradigms": [
      "bfs_coloring",
      "dfs_coloring",
      "union_find_bipartite"
    ],
    "naive_solution_complexity": "O(2^V)",
    "oracle_ast_features": {
      "syntax_error": false,
      "recursion": false,
      "heapq": false,
      "bisect": false,
      "deque": true,
      "dict_memo": false,
      "union_find": false,
      "fenwick": false,
      "kmp_prefix_table": false,
      "rolling_hash": false,
      "z_algorithm": false,
      "nested_loops": 1,
      "adjacency_list": true,
      "coordinate_compression": false
    },
    "oracle_detected_paradigms": [
      "bfs_coloring"
    ]
  },
  "tests": {
    "public_tests": [
      "tests/public/trcb_proto_0024_test.py"
    ],
    "hidden_tests_sha256": "generated-locally-v0",
    "hypothesis_strategy": "strategies.graphs_extended:bipartite_case_strategy",
    "n_hidden_cases": 100,
    "pbt_groups": "strategies.graphs_extended:BIPARTITE_PBT_GROUPS"
  },
  "anti_contamination": {
    "paraphrased": true,
    "identifier_obfuscated": true,
    "minhash_vs_original": null,
    "is_honeypot": false
  },
  "scoring": {
    "correctness_weight": 0.5,
    "pbt_weight": 0.2,
    "optimization_weight": 0.15,
    "productive_divergence_weight": 0.15
  },
  "denial_constraints": [
    {
      "id": "deny_deque",
      "type": "forbidden_construct",
      "forbidden": [
        "deque",
        "collections.deque"
      ],
      "reason": "Force DFS coloring or union-find approach instead of BFS",
      "expected_alternatives": [
        "dfs_coloring",
        "union_find_bipartite"
      ],
      "is_feasible": true
    }
  ]
}
